{
  "profile": "ZTKA01",
  "synthetic": true,
  "comparison": "declared_issued_ms",
  "origin": "https://owner.invalid",
  "account_hex": "01010101010101010101010101010101",
  "root_pin_hex": "5a54525002010101010101010101010101010101010000000000000001046b17d1f2e12c4247f8bce6e563a440f277037d812deb33a0f4a13945d898c2964fe342e2fe1a7f9b8ee7eb4a7c0f9e162bce33576b315ececbb6406837bf51f5",
  "expected_root_fingerprint_hex": "650363c155189c0015b94a30cd545f34c4894e88f12d486f4e47694634068540",
  "accepted_previous_version": "6",
  "accepted_previous_digest_hex": "0909090909090909090909090909090909090909090909090909090909090909",
  "accepted_manifest_hex": "5a544d4102010101010101010101010101010101010000000000000001000000000000000700000000000003e8000000000036f6500909090909090909090909090909090909090909090909090909090909090909046b17d1f2e12c4247f8bce6e563a440f277037d812deb33a0f4a13945d898c2964fe342e2fe1a7f9b8ee7eb4a7c0f9e162bce33576b315ececbb6406837bf51f504018b1bd41b441815d172b5fcaa6b88178f1856c553c28c1dee2aac20e4b75c51dd047cf27b188d034f7e8a52380304b51ac3c08969e277f21b35a60b48fc4766997807775510db8ed040293d9ac69f7430dbba7dade63ce982299e04b79d227873d10404040404040404040404040404040405050505050505050505050505050505000400000000000003e8000000000036f6500102a7f5fac9ffbf8b4528c8cc22c33b6aaa953bcc41110ccbf6ca96b57e6a6241d1045ecbe4d1a6330a44c8f7ef951d4bf165e6c6b721efada985fb41661bc6e7fd6c8734640c4998ff7e374b06ce1a64a2ecd82ab036384fb83d9a79b127a27d50320000000000000000000000000000000000000000000000000000000000000000000c00000000000003e8000000000036f65001049820627b90765b6838372f3ca368aedd591abc11b36b0116111eb210189866d404e2534a3532d08fbba02dde659ee62bd0031fe2db785596ef509302446b030852e0f1575a4c633cc719dfee5fda862d764efc96c3f30ee0055c42c23f184ed8c60404040404040404040404040404040405050505050505050505050505050505000200000000000003e8000000000036f6500106b0d8345f27248e9485b6ab3aeb3d458b6786ee54fa3650613829964e79446587046b17d1f2e12c4247f8bce6e563a440f277037d812deb33a0f4a13945d898c2964fe342e2fe1a7f9b8ee7eb4a7c0f9e162bce33576b315ececbb6406837bf51f50000000000000000000000000000000000000000000000000000000000000000000000000000000003e8000000000036f65001ada5c025961f79b24a510a707956c90938e05e5100b5b859a0d64032a56332907a5c040b7f5b3b9b1b0293af8c9cc4813cf19b912f1a689e57b9552675899ce9",
  "statement_hex": "5a544b4101030707070707070707070707070707070701010101010101010101010101010101001568747470733a2f2f6f776e65722e696e76616c6964000000000000000100000000000000070000000000000001650363c155189c0015b94a30cd545f34c4894e88f12d486f4e476946340685408ddb1fefed2291fc2c1655f08622deaa59ca89eee9ce4d6030eccb4c877afc7ba7f5fac9ffbf8b4528c8cc22c33b6aaa953bcc41110ccbf6ca96b57e6a6241d1045ecbe4d1a6330a44c8f7ef951d4bf165e6c6b721efada985fb41661bc6e7fd6c8734640c4998ff7e374b06ce1a64a2ecd82ab036384fb83d9a79b127a27d503200000000000007d00000000000000bb8c5b01b738c57cc6b292f7ec89e90af5061393433df35fbb24be2802251438b054c9d4533ed0b08b4748ae4847da73b414d1284bf6bc96614c6cbba23c1db8913",
  "unsigned_hex": "5a544b4101030707070707070707070707070707070701010101010101010101010101010101001568747470733a2f2f6f776e65722e696e76616c6964000000000000000100000000000000070000000000000001650363c155189c0015b94a30cd545f34c4894e88f12d486f4e476946340685408ddb1fefed2291fc2c1655f08622deaa59ca89eee9ce4d6030eccb4c877afc7ba7f5fac9ffbf8b4528c8cc22c33b6aaa953bcc41110ccbf6ca96b57e6a6241d1045ecbe4d1a6330a44c8f7ef951d4bf165e6c6b721efada985fb41661bc6e7fd6c8734640c4998ff7e374b06ce1a64a2ecd82ab036384fb83d9a79b127a27d503200000000000007d00000000000000bb8",
  "statement_digest_hex": "3b1a11d1a86a359ebf212abf06337e5a529a412e1d29293438841ce9adc63781",
  "declared_issued_ms": "2000",
  "declared_until_ms": "3000",
  "result_kind": "historical_integrity"
}
